{
  "contract": "adco.chat-visualization@1.0", "view_id": "feedback-impact-v13", "execution_context": "standalone_chat",
  "controller": {"surface_owner": "ad-creative-orchestrator", "user_facing": true}, "phase": "P8",
  "surface": {"kind": "feedback-impact", "title": "反馈影响与确认", "summary": "客户要求弱化产品特写；PPT、PDF 与预览需生成新版本，已经确认可用的主视觉可以保留。", "question": "是否记录这条反馈并生成 v13 修订计划？"},
  "source_truth": {"project_id": "campaign-summer", "current_version": "v12", "artifacts": [{"artifact_id": "feedback-log", "path": "AD-creative/orchestrator/feedback_log.csv", "version": "v12", "sha256": "3333333333333333333333333333333333333333333333333333333333333333", "lifecycle": "current"}, {"artifact_id": "deck", "path": "AD-creative/ppt/exports/proposal-v12.pptx", "version": "v12", "sha256": "4444444444444444444444444444444444444444444444444444444444444444", "lifecycle": "current"}]},
  "presentation": {"fields": [{"id": "feedback", "label": "新反馈", "value": "弱化产品特写，增加消费者反应", "provenance": "source-bound", "source_ref": "feedback-log#/latest"}, {"id": "stale", "label": "需要更新", "value": "v12 提案、PDF、页面预览和文字内容", "provenance": "source-bound", "source_ref": "deck#/derivatives"}, {"id": "preserved", "label": "可以保留", "value": "已经确认可用的主视觉", "provenance": "presentation-only", "source_ref": null}], "options": [], "recommendation": null, "downstream_effects": [{"phase": "P4", "effect": "开始制作下一版提案"}, {"phase": "P8", "effect": "记录后告诉你已保留和需要更新的内容"}]},
  "interactions": {"local_state": ["draft-feedback"], "actions": [{"id": "register-feedback", "label": "记录这条反馈", "kind": "register-feedback", "target_gate": "feedback-adoption-gate", "conversation_intent": "请记录客户关于产品特写的反馈，并先说明哪些内容需要更新、哪些可以保留。"}]},
  "write_boundary": {"component_writes_authoritative_state": false, "conversation_intent_only": true, "write_owner": "ad-creative-orchestrator", "revalidation_command": "adco validate <project>", "forbidden_claims": ["approval", "readiness", "send", "completion", "global-install"]},
  "fallback": {"summary": "这条反馈会更新 v12 提案内容，但已经确认可用的主视觉可以保留。", "table": {"headers": ["对象", "影响"], "rows": [["v12 提案与预览", "需要更新"], ["主视觉", "继续使用"]]}, "mermaid": "flowchart LR\n  F[客户反馈] --> D[更新提案与预览]\n  F --> A[保留主视觉]", "decision_prompt": "是否记录这条反馈并生成 v13 修订计划？"}
}
