{
  "contract": "adco.chat-visualization@1.0", "view_id": "ppt-slide-review-v12", "execution_context": "standalone_chat",
  "controller": {"surface_owner": "ad-creative-orchestrator", "user_facing": true}, "phase": "P5",
  "surface": {"kind": "ppt-slide-review", "title": "PPT 逐页复核", "summary": "当前 v12 的第 7 页存在文字拥挤，第 11 页图片使用授权待确认。", "question": "是否先优化第 7 页排版，并单独确认第 11 页图片可以使用？"},
  "source_truth": {"project_id": "campaign-summer", "current_version": "v12", "artifacts": [{"artifact_id": "deck", "path": "fixtures/chat-visualization/sample-deck.pptx", "version": "v12", "sha256": "036516b5f14fa595f81b4e88f3fea0c3f36d8fcd9fb86167c1c43c3e880138f4", "lifecycle": "current"}, {"artifact_id": "preview", "path": "fixtures/chat-visualization/ppt-slide-preview.svg", "version": "v12", "sha256": "7c81273e490f9f89500635b5872f8dee83411b16228a528e5704a4b53d26ae53", "lifecycle": "current"}]},
  "presentation": {"fields": [{"id": "slide-seven", "label": "第 7 页", "value": "重要：正文拥挤，移动端预览会溢出", "provenance": "source-bound", "source_ref": "preview#/slides/7"}, {"id": "slide-eleven", "label": "第 11 页", "value": "必须确认：图片使用授权尚不明确", "provenance": "source-bound", "source_ref": "preview#/slides/11"}], "options": [], "recommendation": null, "downstream_effects": [{"phase": "P6", "effect": "修改后生成 v13，并更新提案文件与预览"}], "previews": [{"artifact_id": "preview", "label": "第 7 页预览", "alt": "左侧是标题和较密正文，右侧是消费者使用产品的示意画面，正文区域用红框标出。", "caption": "第 7 页：正文在窄屏预览中过密。", "annotations": [{"region": "左侧正文区", "note": "建议压缩为 3 个要点，保留右侧消费者画面。"}]}]},
  "interactions": {"local_state": ["focused-item", "draft-feedback"], "actions": [{"id": "register-slide-feedback", "label": "提交逐页反馈", "kind": "register-feedback", "target_gate": "ppt-review-gate", "conversation_intent": "请登记第 7 页和第 11 页的逐页反馈并核对版本影响。"}]},
  "write_boundary": {"component_writes_authoritative_state": false, "conversation_intent_only": true, "write_owner": "ad-creative-orchestrator", "revalidation_command": "adco validate <project>", "forbidden_claims": ["approval", "readiness", "send", "completion", "global-install"]},
  "fallback": {"summary": "v12 第 7 页排版拥挤，第 11 页的图片使用授权待确认。", "table": {"headers": ["页码", "问题", "优先级"], "rows": [["7", "正文拥挤", "重要"], ["11", "使用授权待确认", "必须确认"]]}, "mermaid": "flowchart LR\n  S7[优化第 7 页排版] --> V13[更新提案]\n  S11[确认第 11 页图片可用] --> V13", "decision_prompt": "是否先优化第 7 页排版，并单独确认第 11 页图片可以使用？"}
}
