{
  "contract": "adco.chat-visualization@1.0", "view_id": "hero-asset-review", "execution_context": "standalone_chat",
  "controller": {"surface_owner": "ad-creative-orchestrator", "user_facing": true}, "phase": "P5",
  "surface": {"kind": "asset-review", "title": "主视觉素材复核", "summary": "主视觉已经用于当前提案，但使用授权仍待确认。", "question": "先确认这张素材可以使用，还是讨论替换方案？"},
  "source_truth": {"project_id": "campaign-summer", "current_version": "v12", "artifacts": [{"artifact_id": "hero-visual", "path": "fixtures/chat-visualization/hero-asset-preview.svg", "version": "v12", "sha256": "35edc7bd46c66f1a868a7a022e1fcf42ba31bfde7b5644e32b45ee15829bcb8b", "lifecycle": "current"}]},
  "presentation": {"fields": [{"id": "asset-role", "label": "用途", "value": "提案封面主视觉", "provenance": "source-bound", "source_ref": "hero-visual#/role"}, {"id": "authorization", "label": "使用授权", "value": "待确认", "provenance": "source-bound", "source_ref": "hero-visual#/authorization"}, {"id": "qa", "label": "画面检查", "value": "通过", "provenance": "source-bound", "source_ref": "hero-visual#/qa"}], "options": [], "recommendation": null, "downstream_effects": [{"phase": "P6", "effect": "确认使用授权后继续整理交付包"}], "previews": [{"artifact_id": "hero-visual", "label": "封面主视觉", "alt": "蓝色渐变背景中，一位消费者在户外使用产品，右侧留有标题和产品位置。", "caption": "当前提案封面主视觉；画面可用性已检查，使用授权仍待确认。", "annotations": [{"region": "右侧产品位", "note": "产品与标题留白充足。"}]}]},
  "interactions": {"local_state": ["focused-item"], "actions": [{"id": "request-asset-path", "label": "查看可用条件", "kind": "request-recheck", "target_gate": "asset-authorization-gate", "conversation_intent": "请告诉我主视觉还需要满足哪些条件才能使用。"}, {"id": "request-replacement", "label": "讨论替换方案", "kind": "request-revision", "target_gate": "asset-authorization-gate", "conversation_intent": "请说明替换主视觉会影响哪些提案内容。"}]},
  "write_boundary": {"component_writes_authoritative_state": false, "conversation_intent_only": true, "write_owner": "ad-creative-orchestrator", "revalidation_command": "adco validate <project>", "forbidden_claims": ["approval", "readiness", "send", "completion", "global-install"]},
  "fallback": {"summary": "主视觉画面检查已经通过，但使用授权仍待确认。", "table": {"headers": ["素材", "用途", "使用授权", "画面检查"], "rows": [["hero-v12.png", "封面", "待确认", "通过"]]}, "mermaid": "flowchart LR\n  A[主视觉] -->|确认可以使用| B[整理交付包]", "decision_prompt": "先确认这张素材可以使用，还是讨论替换方案？"}
}
