{
  "contract": "adco.chat-visualization@1.0", "view_id": "creative-route-comparison", "execution_context": "standalone_chat",
  "controller": {"surface_owner": "ad-creative-orchestrator", "user_facing": true}, "phase": "P3",
  "surface": {"kind": "option-comparison", "title": "创意路线比较", "summary": "两条路线都满足 brief，但情感回报和制作风险不同。", "question": "选择哪条路线进入下一版提案，或提出需要融合的部分？"},
  "source_truth": {"project_id": "campaign-summer", "current_version": "v06", "artifacts": [{"artifact_id": "proposal", "path": "AD-creative/handoff/proposal-v06.md", "version": "v06", "sha256": "dddddddddddddddddddddddddddddddddddddddddddddddddddddddddddddddd", "lifecycle": "current"}]},
  "presentation": {"fields": [{"id": "shared-goal", "label": "共同目标", "value": "让产品证明落在真实消费者时刻", "provenance": "source-bound", "source_ref": "proposal#/goal"}, {"id": "main-risk", "label": "共同风险", "value": "30 秒内信息密度偏高", "provenance": "source-bound", "source_ref": "proposal#/risk"}], "options": [{"id": "route-a", "label": "路线 A：一刻成真", "summary": "以真实使用瞬间推动情绪转折", "tradeoff": "情感更自然，但产品特写较少", "source_refs": ["proposal#/routes/a"]}, {"id": "route-b", "label": "路线 B：证明链", "summary": "以三步产品证明建立可信度", "tradeoff": "信息清楚，但情绪温度较低", "source_refs": ["proposal#/routes/b"]}], "recommendation": {"option_id": "route-a", "reason": "更符合客户要求的消费者视角。"}, "downstream_effects": [{"phase": "P4", "effect": "被选路线将决定 PPT 叙事骨架"}]},
  "interactions": {"local_state": ["selected-option", "expanded-detail"], "actions": [{"id": "choose-route", "label": "提交暂存选择", "kind": "submit-selection", "target_gate": "creative-route-gate", "conversation_intent": "请核对我暂存的创意路线选择及其下游影响。"}, {"id": "request-revision", "label": "提出修改", "kind": "request-revision", "target_gate": "creative-route-gate", "conversation_intent": "我想修改或融合创意路线，请先说明会影响哪些内容。"}]},
  "write_boundary": {"component_writes_authoritative_state": false, "conversation_intent_only": true, "write_owner": "ad-creative-orchestrator", "revalidation_command": "adco validate <project>", "forbidden_claims": ["approval", "readiness", "send", "completion", "global-install"]},
  "fallback": {"summary": "路线 A 情感更自然；路线 B 产品证明更清楚。", "table": {"headers": ["路线", "核心", "权衡"], "rows": [["A", "消费者时刻", "产品特写较少"], ["B", "产品证明链", "情绪较低"]]}, "mermaid": "flowchart LR\n  A[路线 A] --> N[下一版提案]\n  B[路线 B] --> N", "decision_prompt": "选择哪条路线进入下一版提案，或提出需要融合的部分？"}
}
